[
  { "id": "maladie", "icon": "heart", "title": "Assurance maladie", "tag": "LAMal & complémentaires",
    "short": "Optimisez vos primes d'assurance de base et vos complémentaires (LCA) selon vos besoins réels.",
    "points": ["Comparatif LAMal toutes caisses", "Modèles Telmed, médecin de famille, HMO", "Complémentaires hospitalisation & dentaire", "Analyse de franchise optimale"] },
  { "id": "vie", "icon": "piggy", "title": "Prévoyance & 3e pilier", "tag": "3a / 3b",
    "short": "Épargnez pour votre retraite tout en réduisant vos impôts avec une solution 3e pilier sur mesure.",
    "points": ["3e pilier A (déductible d'impôt)", "3e pilier B libre", "Assurance vie & décès", "Planification retraite & rachats LPP"] },
  { "id": "auto", "icon": "car", "title": "Véhicules", "tag": "Auto & moto",
    "short": "RC obligatoire, casco partielle ou complète : la meilleure couverture au meilleur prix.",
    "points": ["RC, casco partielle & complète", "Protection du conducteur", "Bonus/malus optimisé", "Voitures, motos, utilitaires"] },
  { "id": "menage", "icon": "home", "title": "Ménage & RC privée", "tag": "Inventaire & responsabilité",
    "short": "Protégez vos biens et votre responsabilité civile privée avec une couverture complète.",
    "points": ["Assurance inventaire du ménage", "Responsabilité civile privée", "Vol simple & dégâts d'eau", "Protection valeurs & objets de valeur"] },
  { "id": "immobilier", "icon": "building", "title": "Bâtiment & immobilier", "tag": "PPE & propriétaires",
    "short": "Couvrez votre bien immobilier, votre PPE et vos travaux contre tous les risques.",
    "points": ["Assurance bâtiment", "PPE & copropriété", "Dégâts naturels & incendie", "Travaux & maître d'ouvrage"] },
  { "id": "juridique", "icon": "scale", "title": "Protection juridique", "tag": "Privée & circulation",
    "short": "Défendez vos droits sans craindre les frais d'avocat, en toute sérénité.",
    "points": ["Protection juridique privée", "Circulation & véhicules", "Litiges travail & bail", "Conseils juridiques illimités"] },
  { "id": "voyage", "icon": "plane", "title": "Voyage & assistance", "tag": "Annulation & rapatriement",
    "short": "Voyagez l'esprit léger : annulation, frais médicaux et assistance dans le monde entier.",
    "points": ["Frais d'annulation", "Assistance & rapatriement", "Frais médicaux à l'étranger", "Bagages & retards"] },
  { "id": "entreprise", "icon": "briefcase", "title": "Entreprises & indépendants", "tag": "RC pro, LAA, perte de gain",
    "short": "Sécurisez votre activité : responsabilité, personnel, locaux et perte d'exploitation.",
    "points": ["RC professionnelle & entreprise", "LAA & indemnités journalières", "Assurance choses & interruption", "Prévoyance du personnel (LPP)"] },
  { "id": "credit", "icon": "key", "title": "Hypothèques & financement", "tag": "Immobilier & crédits",
    "short": "Financez votre projet immobilier aux meilleures conditions grâce à notre réseau de partenaires.",
    "points": ["Hypothèques & renouvellements", "Comparatif taux multi-banques", "Financement & crédits privés", "Conseil en amortissement"] },
  { "id": "accidents", "icon": "shield", "title": "Accidents", "tag": "LAA & complémentaire",
    "short": "Complétez la couverture légale accidents pour vous et votre famille.",
    "points": ["Complémentaire LAA", "Capital invalidité & décès", "Frais de guérison", "Couverture enfants & non-actifs"] },
  { "id": "animaux", "icon": "paw", "title": "Animaux de compagnie", "tag": "Chiens & chats",
    "short": "Faites face aux frais vétérinaires imprévus sans compromis sur les soins.",
    "points": ["Frais vétérinaires & chirurgie", "Accidents & maladies", "RC détenteur d'animal", "Chiens, chats & NAC"] },
  { "id": "epargne", "icon": "coins", "title": "Épargne & placements", "tag": "Patrimoine",
    "short": "Faites fructifier votre patrimoine avec des solutions d'épargne et de placement adaptées.",
    "points": ["Plans d'épargne", "Fonds & placements", "Optimisation fiscale", "Conseil patrimonial global"] }
]
